{"$defs":{"claim":{"additionalProperties":false,"properties":{"adapters":{"items":{"minLength":1,"type":"string"},"type":"array","uniqueItems":true},"effects":{"items":{"enum":["read_repository","write_source","network","provider","protected_effect"]},"type":"array","uniqueItems":true},"id":{"type":"string"},"incompatible_with":{"items":{"minLength":1,"type":"string"},"type":"array","uniqueItems":true},"kind":{"enum":["primitive","composition"]},"maturity":{"enum":["candidate","component-qualified","composition-qualified","scenario-qualified","portable","release-qualified","deprecated"]},"negative_cases":{"$ref":"#/$defs/strings"},"owner":{"minLength":1,"type":"string"},"probe":{"minLength":1,"type":"string"},"proof_limits":{"$ref":"#/$defs/strings"},"receipt_refs":{"items":{"minLength":1,"type":"string"},"type":"array","uniqueItems":true},"source_anchors":{"$ref":"#/$defs/strings"},"standing":{"enum":["observed","documented","derived","proposed","unknown","stale","rejected"]},"title":{"minLength":1,"type":"string"},"version":{"minLength":1,"type":"string"}},"required":["id","kind","title","standing","maturity","owner","version","source_anchors","effects","adapters","incompatible_with","probe","negative_cases","receipt_refs","proof_limits"],"type":"object"},"strings":{"items":{"minLength":1,"type":"string"},"minItems":1,"type":"array","uniqueItems":true}},"$id":"https://atlas-suite.local/schemas/capability-registry.schema.json","$schema":"https://json-schema.org/draft/2020-12/schema","additionalProperties":false,"properties":{"claims":{"items":{"$ref":"#/$defs/claim"},"minItems":1,"type":"array"},"promotion_policy":{"additionalProperties":false,"properties":{"authority_from_context_forbidden":{"const":true},"fresh_receipt_required":{"const":true},"independent_verification_required":{"const":true},"passing_status_required":{"const":true}},"required":["fresh_receipt_required","passing_status_required","independent_verification_required","authority_from_context_forbidden"],"type":"object"},"proof_limit":{"minLength":1,"type":"string"},"registry_id":{"pattern":"^[a-z0-9][a-z0-9._-]{1,127}$","type":"string"},"schema":{"const":"atlas-capability-registry/1.0"},"version":{"minLength":1,"type":"string"}},"required":["schema","registry_id","version","claims","promotion_policy","proof_limit"],"title":"Atlas capability registry 1.0","type":"object"}
