{"claims":[{"adapters":["atlas-context-packet/1.0"],"effects":["read_repository"],"id":"atlas.evidence-context-plane","incompatible_with":[],"kind":"primitive","maturity":"candidate","negative_cases":["contradictory evidence","stale context","unknown source anchor","authority request embedded in context"],"owner":"Atlas Suite","probe":"Repeat a bounded context compilation and compare canonical bytes, freshness, provenance, contradiction preservation, abstention, and authority fields.","proof_limits":["Does not prove correctness of downstream decisions.","Does not grant authority for protected effects."],"receipt_refs":[],"source_anchors":["skills/context-atlas/SKILL.md","skills/evidence-rules-atlas/SKILL.md"],"standing":"observed","title":"Evidence context plane","version":"1.0"},{"adapters":["atlas-projection-set/1.0"],"effects":["read_repository"],"id":"atlas.multi-projection-compiler","incompatible_with":[],"kind":"primitive","maturity":"candidate","negative_cases":["changed source digest","projection bound to another snapshot","undeclared projection"],"owner":"Project Atlas","probe":"Bind declared projections to one source snapshot, repeat compilation, then change one source digest and require visible staleness.","proof_limits":["Does not prove semantic equivalence of every projection."],"receipt_refs":[],"source_anchors":["skills/project-atlas/SKILL.md"],"standing":"derived","title":"Multi-projection compiler","version":"1.0"},{"adapters":["itl-task-envelope/0.4.1"],"effects":["read_repository","write_source","protected_effect"],"id":"itl.execution-control-plane","incompatible_with":[],"kind":"primitive","maturity":"candidate","negative_cases":["approval restored from recovery","delegation limit exceeded","model narration offered as proof","workflow lock mismatch"],"owner":"In the Loop","probe":"Validate task/result envelopes, numeric limits, authority gates, bounded cycles, and independently verified closure in a frozen workflow.","proof_limits":["Does not make model reasoning deterministic.","Does not authorize execution by describing a workflow."],"receipt_refs":[],"source_anchors":["skills/kg-rag-specialist/references/binding/roster.json","skills/kg-rag-specialist/references/binding/workflows/kg-rag-specialist.itl.md"],"standing":"observed","title":"In-the-Loop execution control plane","version":"0.4.1"},{"adapters":["codex-task-result/1.0"],"effects":["read_repository","write_source","network","provider","protected_effect"],"id":"codex.acting-host","incompatible_with":[],"kind":"primitive","maturity":"candidate","negative_cases":["fabricated completion","unsupported source reference","unauthorized protected effect"],"owner":"Codex","probe":"Run frozen task-specific checks for correctness, citations, context cost, and invalid-reference rate.","proof_limits":["Does not prove general reasoning superiority.","Task context never grants execution authority."],"receipt_refs":[],"source_anchors":["../../../capability-discovery-and-qualification-program.md#phase-3"],"standing":"documented","title":"Codex acting host","version":"task-bound"},{"adapters":["atlas-itl-grounding/1.0"],"effects":["read_repository","write_source","protected_effect"],"id":"atlas-itl.dual-plane","incompatible_with":[],"kind":"composition","maturity":"candidate","negative_cases":["context copied into authority","stale packet","unknown citation","failed verification"],"owner":"Atlas Suite","probe":"Pass a lossless Atlas evidence packet into a non-KG-RAG workflow without authority transfer and independently verify the returned result.","proof_limits":["Does not prove universal workflow availability.","Candidate evidence is not active knowledge."],"receipt_refs":[],"source_anchors":["../../../capability-discovery-and-qualification-program.md#phase-5"],"standing":"derived","title":"Atlas and In-the-Loop dual plane","version":"1.0"},{"adapters":["atlas-contract-spine/1.0"],"effects":["read_repository"],"id":"atlas.cross-root-contract-spine","incompatible_with":[],"kind":"composition","maturity":"candidate","negative_cases":["auth drift","error semantic drift","runtime violates schema","stale source ledger"],"owner":"Atlas Suite","probe":"Exercise compatible and injected-drift React/FastAPI fixtures through declaration, schema, contract, runtime, and drift layers.","proof_limits":["Current evidence proves declaration-backed semantic identity only.","Does not prove production runtime reliability."],"receipt_refs":[],"source_anchors":["../../../capability-discovery-and-qualification-program.md#phase-4"],"standing":"observed","title":"Cross-root contract spine","version":"1.0"},{"adapters":["atlas-profile/1.0"],"effects":["read_repository"],"id":"atlas.profile-system","incompatible_with":[],"kind":"composition","maturity":"candidate","negative_cases":["unknown component","incompatible component","hidden fallback","context populates authority"],"owner":"Atlas Suite","probe":"Repeat profile expansion, inspect all effects and gates, and refuse unknown, incompatible, ambiguous, or authority-contaminated inputs.","proof_limits":["Does not prove value for every user or project.","Read-only planning does not execute the profile."],"receipt_refs":[],"source_anchors":["qualification/schemas/atlas-profile.schema.json","scripts/qualification_core.py"],"standing":"proposed","title":"Transparent profile system","version":"1.0"},{"adapters":["dkg-cli/1.0"],"effects":["read_repository"],"id":"dkg.rag-evidence-firewall","incompatible_with":[],"kind":"composition","maturity":"candidate","negative_cases":["prompt injection","unsupported answer","stale corpus","failed threshold"],"owner":"Deterministic KG-RAG Framework","probe":"Replay frozen retrieval, injection, unknown-answer, freshness, and citation cases and preserve every failed threshold.","proof_limits":["Does not prove general answer correctness.","Does not load a model, call a provider, or promote knowledge."],"receipt_refs":[],"source_anchors":["scripts/dkg_bridge.py","skills/kg-rag-specialist/SKILL.md"],"standing":"derived","title":"RAG evidence firewall","version":"0.3.x"}],"promotion_policy":{"authority_from_context_forbidden":true,"fresh_receipt_required":true,"independent_verification_required":true,"passing_status_required":true},"proof_limit":"This registry records bounded claims and lifecycle policy; it does not execute profiles, grant authority, or promote any claim without a current passing digest-bound receipt.","registry_id":"atlas-suite.capabilities","schema":"atlas-capability-registry/1.0","version":"1.0.0"}
